{
  "reservation_version": "SR-RESERVATION.v0.1.0",
  "namespace": "SR-OBJ",
  "value": "SR-OBJ-000033",
  "operation_key": "2026-09-new-papers-hm-object",
  "purpose": "Admit Tier-2 paper: How Much of a Thing Must Remain the Same? Burden-Relative Preservation, Support, Identity, and the Boundary of Reditus",
  "state": "published",
  "reserved_at": "2026-09-26T19:47:34Z",
  "route": "cli",
  "published_record_path": "registry/objects/SR-OBJ-000033.json"
}
