{
  "reservation_version": "SR-RESERVATION.v0.1.0",
  "namespace": "REL",
  "value": "REL-000007",
  "operation_key": "2026-09-new-papers-ad-seam",
  "purpose": "Admissible Determination v1.1.0, section 1.1: retains observational accountability while explicitly revising the earlier objection to exteriority. This conceptual revision does not rewrite The Seam of Reality or import its historical audit budget or receipt.",
  "state": "published",
  "reserved_at": "2026-09-26T19:47:34Z",
  "route": "cli",
  "published_record_path": "registry/relations/REL-000007.json"
}
