{
  "reservation_version": "SR-RESERVATION.v0.1.0",
  "namespace": "SRC",
  "value": "SRC-000061",
  "operation_key": "2026-09-new-papers-ad-source",
  "purpose": "Register released paper: Admissible Determination: Legitimate Selectivity, Observation, and Time in Structura Reditus",
  "state": "published",
  "reserved_at": "2026-09-26T19:47:34Z",
  "route": "cli",
  "published_record_path": "registry/sources/SRC-000061.json"
}
